{
  "version": "0.1-stress",
  "seed_policy": "deterministic",
  "canonical_representation": "point(x,y,t,pen)",
  "tests": [
    {"name": "prefix_points", "params": {"k": [10, 20, 30, 50, 70]}},
    {"name": "prefix_strokes", "params": {"k": [10, 20, 30, 50, 70]}},
    {"name": "stroke_dropout", "params": {"p": [0.3, 0.5, 0.7, 0.9]}},
    {"name": "point_dropout", "params": {"p": [0.3, 0.5, 0.7, 0.9]}},
    {"name": "resample_uniform", "params": {"N": [4, 8, 16]}},
    {"name": "resample_arclength", "params": {"N": [4, 8, 16]}},
    {"name": "subsample_ratio", "params": {"r": [0.1, 0.25, 0.5]}},
    {"name": "simplify_rdp", "params": {"epsilon": [1.5, 3.0, 5.0]}},
    {"name": "simplify_ratio", "params": {"ratio": [0.1, 0.25, 0.5]}},
    {"name": "split_stroke", "params": {"k": [3, 4]}},
    {"name": "merge_strokes", "params": {"threshold": [0.01, 0.02]}},
    {"name": "penup_noise", "params": {"drop_prob": [0.2, 0.3], "insert_prob": [0.2]}},
    {"name": "reverse_strokes", "params": {}},
    {"name": "local_shuffle_strokes", "params": {"window": [3, 5]}},
    {"name": "reverse_points_within_stroke", "params": {}},
    {"name": "time_warp", "params": {"factor": [0.25, 0.5, 1.5, 2.0]}},
    {"name": "jitter_xy", "params": {"sigma": [0.02, 0.05, 0.1]}},
    {"name": "quantize_xy", "params": {"bits": [2, 3, 4]}},
    {"name": "timestamp_jitter", "params": {"sigma": [1.0, 3.0]}},
    {"name": "translate", "params": {"dx": [0.15], "dy": [0.15]}},
    {"name": "scale", "params": {"factor": [0.7, 0.85, 1.15, 1.3]}},
    {"name": "rotate", "params": {"degrees": [-45, -30, 30, 45]}},
    {"name": "start_point_shift", "params": {"shift_pct": [25, 50, 75]}},
    {"name": "dropout_jitter", "params": {"p": [0.5, 0.7], "sigma": [0.05]}},
    {"name": "resample_rotate", "params": {"N": [4, 8], "degrees": [30, 45]}},
    {"name": "split_shuffle", "params": {"k": [3, 4], "window": [3, 5]}},
    {"name": "quant_scale", "params": {"bits": [2, 3], "factor": [0.7, 0.8]}}
  ],
  "confusion_sets": [],
  "scoring": {
    "headline": ["clean_acc", "prefix_auc", "robustness_auc", "worst_cluster_acc"],
    "weights": {
      "prefix_points_robustness": 1.0,
      "prefix_strokes_robustness": 1.0,
      "stroke_dropout_robustness": 1.0,
      "point_dropout_robustness": 1.0,
      "resample_uniform_robustness": 1.0,
      "resample_arclength_robustness": 1.0,
      "subsample_ratio_robustness": 1.0,
      "simplify_rdp_robustness": 0.5,
      "simplify_ratio_robustness": 0.5,
      "split_stroke_robustness": 1.0,
      "merge_strokes_robustness": 1.0,
      "penup_noise_robustness": 1.0,
      "reverse_strokes_robustness": 1.0,
      "local_shuffle_strokes_robustness": 1.0,
      "reverse_points_within_stroke_robustness": 1.0,
      "time_warp_robustness": 1.0,
      "jitter_xy_robustness": 1.0,
      "quantize_xy_robustness": 1.0,
      "timestamp_jitter_robustness": 0.5,
      "translate_robustness": 0.25,
      "scale_robustness": 0.25,
      "rotate_robustness": 0.25,
      "start_point_shift_robustness": 0.5,
      "dropout_jitter_robustness": 1.0,
      "resample_rotate_robustness": 1.0,
      "split_shuffle_robustness": 1.0,
      "quant_scale_robustness": 1.0
    }
  }
}
